"1900","Military Hospital Blood Bank","26.289543","73.047169","Cantt Area; Jodhpur. ","9414084387"
"1901","Kanun Devi Parasmal Mehta Medical and Blood Bank","26.27777","73.015288","733; 1st - C Road; Sardarpura","9784732000"
"1902","Kalapurnam General Hospital Khichan Blood Bank","27.115405","72.415203","Bhatiyara Mohalla; Jodhpur.","07568288089, 09414794973"
"1903","Ambika Hospital Blood Bank","26.231723","73.021055","B-22;23; Saraswati Nagar;  Madhuban Housing Board; Basni","9610444411"
"1904","AIIMS Hospital Blood Bank","26.241422","73.004365","Basni Industrial Area; Phase-2; Jodhpur.","N/A"
"1905","Jodhpur Medical College","26.269415","73.007401","Near Sriram Excellency Hotel; Opposite Petrol Pump; Jodhpur. ","0291 2740741"
"1906","Government Hospital Karauli Blood Bank","26.500853","77.025833","Gulab Bagh","9887117390"
"1907","Kota Blood Bank Society","25.15205","75.835195","Kota; 1-Basant Bihar; Dadabari; Near Modi College","7442410100"
"1908","Krishna Rotary Blood Bank","25.153422","75.851833","1-A- 12; S.F.S.; Doctors Enclave; Talwandi","094141 88106, 09929603369"
"1909","Maharao Bhimsingh Hospital Blood Bank","25.198998","75.856664","Maharao Bhimsingh Hospital; Nayapura; Kota.","8058706597"
"1910","New Hospital  Medical College Blood Bank","25.119971","75.831146","Ganesh Nagar Road; Rama Krishna Puram; Kota.","N/A"
"1911","Shri Ram Blood Bank","25.144698","75.837722","Shri Ram Hospital ; Sheela Choudhary Rd; New Rajeev Gandhi Nagar; VIP Colony; Talwandi;","9414167587"
"1912","Sudha Blood Bank","25.150517","75.852151","Sudha Hospital and Research Centre Private Limited; 11-A; Talwandi; Jhalawar Road; VIP Colony; Talwandi; Kota.","09461736905, 09166457841"
"1913","Bharat Vikas Parishad Chikitshalya Blood Bank","25.16239","75.831475","Pratap Nagar; Dada Bari","094141 80505, 09571311112"
"1914","Government Hospital Blood Bank","27.207987","73.737224","Bikaner Road; Near Balwa Nagaur ","9414463645"
"1915","Government Bangar Hospital Blood Bank","25.776368","73.332182","Bangar Hospital; Veer Durga Das Nagar; Pali","9414644635"
"1916","Government Hospital Blood Bank","25.922226","73.663357","Sojat","N/A"
"1917","Bhagwan Mahavir Hospital Blood Bank","25.132911","73.11258","Jawai Bhand Road ; Ramnagar","098285 52764, 09413337981"
"1918","Government District Hospital Blood Bank","25.6835288","81.9984388","District Hospital Blood Bank; Pratapgarh.","9782518462"
"1919","R.K. District Hospital Blood Bank","25.024193","73.883611","Haribhau Upadhyay Nagar; Rajsamand.","9413204230"
"1920","Riya Hospital Blood Bank","26.487535","76.740236","NH 11B; Adarsh Nagar","9414506583"
"1921","Sawai Madhopur Government General Hospital Blood Bank","25.217543","75.837287","Alampur chowk  Housing Board Rd; Housing Board; Sawai Madhopur;","9214311187"
"1922","S.K. Hospital Blood Bank","27.61311","75.150577","silver Jubilee Road; Near SK College","9414463645"
"1923","Shri MunshiRam Mittal Memorial Seva Samiti Blood bank","27.612976","75.150611","Opposite to  S.K. School; Silver Jubilee Road; ","09214205889, 09414325671"
"1924","Dr. K.M. Memorial Jain Heart & General Hospital Blood Bank","27.613529","75.145288","Station Road; Subhash Chowk","9414075108"
"1925","Getwell Hospital and Research Center Blood Bank ","27.611508","75.149061","Opp.S.K. School;Near; Dr.B.L.Ranwa (Physician)","8854801375"
"1926","Government General Hospital Blood Bank","24.88629","72.859424","Palace Road Sirohi; Near Govt College Sirohi;","9414272256"
"1927","Rotary International Global Hospital Blood Bank","24.538286","72.801958","Radha Mohan Mehrotra Global Hospital Trauma Centre;  Opposite Modern Insulators Ltd.; Talhati; Abu Road",""
"1928","Government Hospital Blood Bank","29.903133","73.873964","Hardeep Colony; Sri Ganganagar.","9414728810"
"1929","Tapovan Blood Bank","29.913206","73.881827","Opposite to Jawahar Nagar Tehsil Bhawan ",""
"1930","Swastik Blood Bank ","29.91577","73.87975","Gagan Path; Jhawar Nagar; Jawahar Nagar","9829604601"
"1931","Purohit Charitable Trust Blood Bank","29.923281","73.874708","11-12 G Block; Gaushala road","9414280808"
"1932","Sadat Government Hospital Blood Bank","26.176904","75.785332","Sadat Government Hospital; Bahir Colony; Tonk","9414211998"
"1933","Maharana Bhupal Government Hospital Blood Bank","24.589107","73.692338","Hospital Rd; City&#39;s Prime Health Care Area","9414471024"
"1934","GBH American Hospital Blood bank","24.593634","73.696364"," 101; Kothi Bagh; Bhatt Ji Ki Bari; Meera Girls College Road","09829252112, 09414236370"
"1935","Geetanjali Medical College and Hospital Blood Bank","24.553352","73.731888","Hiranmagri Extension; Manwakhera NH-8 Bypass; Near Eklingpura Chouraha","09461467755, 09414328867"
"1936","Saral Blood Bank","24.594033","73.698544","Smt. Sarala Singhvi Charitable Society;  30; Bhikharinath Ka Math; Bhupalpura",""
"1937","Lokmitra Blood Bank and Thalassemia Research Centre","24.581121","73.712858","205; Bussiness Centre; Madhuvan",""
"1938","Pacific Medical College and Hospital Blood Bank","24.668857","73.70231","Bhilon ka Bedla; N.H. 27; Pratap Pura; Girwa","9414464388"
"1939","Central Blood Bank STNM Hospital","27.331167","88.614144","STNM Hospital Complex ;NH 31A ; Gangtok;  East Sikkim ",""
"1940","Central Referral Hospital Blood Bank","27.316213","88.597237","Manipal Central Referral Hospital ; 5th Mile Tadong;  Gangtok. Sikkim Manipal Instutute of Medical Sciences; National Highway 31A","9957195986"
"1941","Government General Hospital Blood Bank","27.165618","88.360388","Namchi District Hospital; Hospital Road; Namchi","7797895320"
"1942","Government  Head quarters Hospital","0","0","Perambalur Road; Ariyalur",""
"1943","CANCER INSTITUTE HOSPITAL BLOOD BANK","13.005335","80.239623","Cancer Institute (WIA) ;No.18 Sardar Patel road",""
"1944","Rajiv Gandhi Government General Hospital","13.081279","80.27678","General Hospital Road Park Town; Chennai; Tamil Nadu ","9436120190"
"1945","The Institute of Child Health and Hospital for Children","13.072798","80.258257","Halls Road; Egmore; Chennai","09445142097, 09941173095"
"1946","Government Kilpauk Medical College Hospital Blood Bank","13.078315","80.243824","Government Kilpauk Medical College and Hospital;                    822; Poonamallee High Rd; Kilpauk; Chennai  ","9941242840"
"1947","Southern Railway Headquarters Hospital","13.101967","80.232996","Ayanavaram Chennai; Tamil Nadu ","9841896599"
"1948","ESIC Hospital And Occupational Diseases Centre Blood Bank","13.034844","80.2083","Ashok Pillar Main Road; K.K. Nagar;Chennai","9840362852"
"1949","Apollo Hospital Enterprises Limited Blood Bank","13.063084","80.251472","No:21; Greams Lane; Off Greams Road; Thousand Lights West; Thousand Lights; Chennai ","9894769935"
"1950","Jeevan Blood Bank and Research Centre","13.064595","80.241688","22/11; Wheatcrofts Road; Nungambakkam Chennai; Tamil Nadu 600034","093817 75666"
"1951","Apollo Speciality Hospital Blood Bank","13.033595","80.24507","4th Floor; Geo Tower; Old No.319; New No.465; Anna Salai; Nandanam; Chennai","N/A"
"1952","Madras Medical Mission(Institute of Cardio Vascular Diseses)","13.085812","80.187029","No. 4 Dr.Jayalalitha Nagar; Mogapair","N/A"
"1953","Kanchi Kamakoti Child Trust Hospital Blood Bank","13.057336","80.245785","12 A; Nageshwara Road; Nungambakkam; Chennai","98404598978"
"1954","Vijaya Hospital Blood Bank","13.049867","80.208392","New No: 434 (OId No: 180); N.S.K Salai; Vadapalani","N/A"
"1955","MIOT Hospital Blood Bank","13.021971","80.186066","No. 4/112 Mount Poonamelle Road; Manapakkam; Chennai","N/A"
"1956","Hindu Mission Hospital Blood Bank","12.923848","80.113982","103; GST Road; Tambram; Patel Nagar; Tambaram;Chennai","N/A"
"1957","Lions Blood Bank and Research Centre","0","0","Doctors Plaza No. 5A/1  V.O.C. Street  Opposite to Shanmugan Road; West Tambram","N/A"
"1958","International Centre for Cardio Thoracic and Vascular Diseases","13.076019","80.181451","R-30c; Ambattur Industrial Estate Road; Mogappair;Chennai","9790840976"
"1959","Dr.Kamatchi Memorial and Blood Component Research Centre ","12.949232","80.209635","Run by Kamatchi Memorial Trust; 1 Radial Road; Pallikaranai; Rose Avenue; Chennai","N/A"
"1960","Bharathiraja Speciality Hospital Blood Bank","13.048082","80.245055","20 Gopathi Narayanaswami Chetty Road; Thiyagaraya Nagar Parthasarathy Puram; T.Nagar Chennai","9443478202"
"1961","Global Hospitals Blood Bank (A unit of Rabindranath GE Medical Association Pvt Ltd","12.898506","80.206289","439; Cheran Nagar; Perumbakkam Cheran Nagar; Perumbakkam; Chennai","N/A"
"1962","Sri Ramachandra Medical College and Research Institute Blood Bank","13.038833","80.143534","No.1; Ramachandra Nagar; Porur; Chennai","N/A"
"1963","Rotary Blood Bank","12.98107","80.195475","Medavakkam Main Rd; Vanuvampet; Madipakkam; Chennai","N/A"
"1964","St Thomas Blood Bank and Research Centre St Thomas Hospital","13.012134","80.19625","5/105; II floor Defence Colony Road; St. Thomas Mount","N/A"
"1965","Right Hospitals Blood Bank","13.078914","80.240581","No.1; Professor Subramaniam Street; Kilpauk","N/A"
"1966","Apollo Hospitals Blood Bank","13.071266","80.150603","Run by Apollo Hospitals Educational Trust; No. 64; Fourth Floor; Vanagaram to Ambattur Main Road; Ayanambakkam","N/A"
"1967","Landsteiner Lakshmi Memorial Research Foundation","13.079435","80.257308","14/90; Ground Floor; First Floor and Second Floor; Ayyavoo Street; Aminijikarai","8012999900"
"1968","Madras Egmore Lions Blood Bank and Research Foundation","13.069705","80.260797","Egmore Lions Blood Bank and Research Foundation; 130 Marshall Road; Egmore Chennai","8012999900"
"1969","Government Royapettah Hospital Blood Bank","13.054709","80.265073","No 1; Westcott Road; Royapettah; Chennai; Tamil Nadu ","9940030580"
"1970","Government Peripheral Hospital Blood Bank","13.095428","80.219317","Government Peripheral Hospital  M-2; Third Avenue;  Anna Nagar;   (Near K-4 Police Station) Chennai","9551107853"
"1971","Government Kasthurbai Gandhi Hospital for Women & Children","13.059296","80.278431","Victoria Hostel Rd; Triplicane; Chennai; Tamil Nadu","9444955617"
"1972","Institute of Obstetrics and Gynaecology Government Hospital for Women and Children","13.073689","80.259207","Police Commisioners Rd; Egmore; Chennai; Tamil Nadu","9941823003"
"1973","Government RSRM Hospital","13.108993","80.288403","Cemetery Road; Royapuram; Chennai; Tamil Nadu ","9840570494"
"1974","Chennai Port Trust Hospital Blood Bank","13.085925","80.291757","No.10 Spring Heaven Road; George Town; Chennai; Tamil Nadu",""
"1975","ESI Hospital Blood Bank","13.094828","80.240417","The Blood Bank Medical Officer; ESI Hospital; Ayanavaram;  Chennai","9443285809"
"1976","Rotary Central TTK Voluntary Health Services (Dr Raganathan Memorial Blood Bank)","13.002059","80.24716","Tharamani; Adyar; Chennai; Tamil Nadu","9444021560"
"1977"," AA Lab Blood Bank","13.054067","80.239828","Old No 12 New No 23; 5th Cross Street; Nungambakkam Nungambakkam Chennai; Tamil Nadu","09444368721, 09884067846"
"1978","Sree Venkateswara Blood Bank","13.109828","80.281945","158; Mannarswamy Kovil Street Royapuram Chennai; Tamil Nadu","09841067775, 09786631490"
"1979","CSI Rainy Multi Speciality Hospital","13.11812","80.290511","45; GA Road; Old Washermanpet; Chennai; Tamil Nadu ",""
"1980","Dhanvandri Blood Bank and Research Centre of Sreemahalakshmi Charitable Health Trust","13.031013","80.231629","F-1; 52A; T.Nagar; S W Boag Rd;CIT Nagar; Chennai; Tamil Nadu","N/A"
"1981","ACS General Hospital ","13.06852","80.131421","Run by Dr MGR Educational Reaserch Institute; Poonamalle High Road; Chennai- Bangalore Highway NH4; Velappanchava Chennai; Tamil Nadu ",""
"1982","Muthukumaran Medical College Hospital and Research Institute","13.017931","80.108969","Chikkarayapuram; Chennai; Tamil Nadu","N/A"
"1983","Tagore Medical College Hospital Blood Bank","12.860204","80.291655","Vandalur - Kelambakkam Road; Melakkottaiyur Post; Near Vandalur; Rathinamangalam; Chennai; Tamil Nadu","9551757371, 9443704267"
"1984","Fortis Malar Hospitals Limited Blood Bank","13.01006","80.258702","52; First Main Road; Gandhi Nagar; Adyar","9176633665"
"1985","Madha Medical College and Hospital Blood Bank","13.004678","80.112061","State Highway 113;Thandalam;Kovur; Harijana Colony Chennai; Tamil Nadu","8148077777"
"1986","Billroth Hospitals Limited Blood Bank","13.075671","80.227297","No.56 & 57; New Door No;5& AMP:7 Gajapathy Street; Shenoy Nagar; Chennai","9840538108"
"1987","Government Stanley Hospital Blood Bank","13.105854","80.285439","305 OSH Rd; Royapuram; Chennai; Tamil Nadu","9840053283"
"1988","M/S SRM Institutes For Medical Science","0","0"," No.1 Block B; First Floor; Jawaharlal Nehru Salai; ( 100 feet road)  Vadapalani",""
"1989","Government Kasturba Gandhi Hospital Blood Bank","0","0","Chennai",""
"1990","Sree Balaji General Hospital Blood Bank","12.954308","80.137703","7; Works Road; Chrompet;Chennai","N/A"
"1991","Indian Red Cross Society Blood Bank","0","0","Tamil Nadu Branch; No; 50 Montieth Road;Egmore","09443076418, 08754040286, 09444441898"
"1992","The Tamil Nadu Dr. MGR Medical University Blood Bank","13.009896","80.218188","69; Anna Salai; Guindy;Chennai",""
"1993","ESI Hospital Blood Bank","11.009114","77.023704","ESI Hospital; Kamarajar Road; Uppilipalayam; Varadharajapuram(P.O)","9788172927"
"1994","Coimbatore Medical College Hospital Blood Bank","10.994861","76.969577","Trichy Road; Kallimadu; Coimbatore","9843193801"
"1995","KG Hospital Blood Bank","11.000435","76.971556","5; Government Arts College Road; Coimbatore","9486499369"
"1996","PSG Hospital Blood Bank","11.018766","77.007145","Avinashi Road; Kalluri Nagar; Peelamedu; PSG Medical College And Hospital Campus; Coimbatore","N/A"
"1997","G. Kuppusamy Naidu Memorial Hospital Blood Bank","11.01277","76.980509","P.B. No. 6327; Nethaji Road; Pappanaickenpalayam; Coimbatore","093455 02499"
"1998","Ramakrishna Hospital Blood Bank","11.023686","76.976713"," No. 395 Sarojini Naidu Road ; New Siddhapudur; Coimbatore ","8870157558"
"1999","Ramana Gounder Medical Trust Hospital Blood Bank","11.07054","76.942457","Mettupalayam Road; S. F. No. 47 and 48 Thudaiyalur ","N/A"
"2000","Ganga Hospital Blood Bank","11.025162","76.952501","No. 313; Mettupalayam Road; Saibaba Koil; Coimbatore ","N/A"
"2001","Kongu Nadu Hospital Private Limited Blood Bank","11.018134","76.960595","336 to 353 Dr. Rajendra Prasad Road; (100 feet Road) 11th St; Tatabad; Coimbatore","N/A"
"2002","Lions Club of Coimbatore Legend Blood Bank Research Centre","11.005808","76.951074","Red Rase Tower No.422 DB Road; R.S. Puram","N/A"
"2003","Shanthi Social Services Medical Centre Blood Bank","11.003734","77.038048","Neelikonampalayam; Coimbatore ","9629297329"
"2004"," Kuriji Hospital Blood Bank (A Unit of Vangal Amman Health Service Limited)","11.019604","76.994964","522/3; Udayampalayam Road; Sowripalayam Post","9629297329"
"2005","Sree Abirami Hospital Private Limited Blood Bank","10.952537","76.973216","No. 33; Madukkarai Road; Sundarapuram; Coimbatore","N/A"
"2006","Government Hospital Blood Bank","11.304849","76.937118"," Ooty main road; Mettupalayam; Coimbatore","098437 06590"
"2007","Sheela Hospitals Blood Bank","11.018303","76.960319","No. 117; East Power House road; Tatabad;Coimbatore","094435 51497"
"2008","Kovai Medical Centre and Hospital Blood Bank","11.042085","77.040324","3209 Avinashi Road; Sitra; Coimbatore","097897 28148, 09843017817"
"2009","IMA Rotary Midtown Mahaveer Blood Bank","11.005732","76.960893"," 92; Syrian Church Road; RS Puram; Coimbatore  ","097879 69099"
"2010","The Coimbatore Bio Medical Services Blood Bank","11.014581","76.953349","No.190A; Bashyakarlu Road East; R.S. Puram","097913 60516"
"2011","Karpagam Hospital Blood Bank","10.885007","77.008223","Pollachi Main Road; Othakkalmandapam; Coimbatore","N/A"
"2012","Swaasam Blood Bank (Run by Any time Blood Voluntary Association)","11.024262","76.984656","Shop No. 9/3; Sakthi estate; M. G Road; Avarampalayam;  Coimbatore","099425 44454, 09942344454"
"2013","RVS Hospital Blood Bank","11.028425","77.134135","242-B; Trichy Rd;Mathiyalagan Nagar;Sulur;  ",""
"2014","Government Hospital Blood Bank","10.658046","77.009584","Government Hospital; NH209;Mahalingapuram;Udumalpet Road;Pollachi","9865305136"
"2015","Pollachi Blood Bank Services","10.665479","77.007079","No : 6; Kanitha methai Ramaujam Street; Venkatesa Colony; Pollachi","98430181803"
"2016","Rajah Muthiah Medical College and Hospital Blood Bank","11.398477","79.718821","Annamalai Nagar; Chidambaram","9944669799"
"2017","Kamaraj Government Hospital Blood Bank","11.394771","79.699614","S.P.Kovil Street; Chidamabaram bus stand; Chidambaram","0 9842381535"
"2018","Hi Tech Blood Bank and Research Foundation","0","0","No. 2; Chinnappa Mudali Street Manja Kuppam","N/A"
"2019","Government Hospital Blood Bank","11.515577","79.316767","Government  Hospital; Viruduchalam (T.K)","9688034114"
"2020","Government Head Quarters Hospital Blood Bank","11.756684","79.759266","Nellikuppam road; Cuddalore","9443253439"
"2021","Blood Donor Association Blood Bank","0","0","No. 17A; Hospital Road ; Cuddalore","09367612970, 09360633822"
"2022","Neyveli Lignite Corporation","11.537043","79.467181","NH532; M.K Colony; Neyveli; Tamil Nadu","9791557028"
"2023","Dharmapuri Medical College Hospital Blood Bank","12.122192","78.156738","3/29A; Nethaji Bye Pass Road; Kamalakhsmi Colony; Dharmapuri","9443166388"
"2024","Ashok Blood Bank and Clinical Laboratory","12.132581","78.161182","No. 63A; Sengodipuram Road IInd Floor; Dharmapuri","9843260627"
"2025","Om Sakthi Blood Bank","12.132676","78.161652","No 4 Sengodipuram; Dharmapuri","93456102799"
"2026","Christian Community Health Center and Hospital Blood Bank","10.545977","77.725236","Shanthipuram; Ambilikkai; Tamil Nadu ","8940487508"
"2027","St.Joseph Hospital Blood Bank","10.370257","77.980644","Chennai Theni Highway; Nehruji Nagar","9942018383"
"2028","Indian Blood Bank","0","0","2/2 Spencor&#39;s Compound ","N/A"
"2029","Dindigul Blood Bank","10.366656","77.977708","No. 28/2; Veppan thoppu street; Palani Road; Dindigul","9443177063"
"2030","Government Head quarters Hospital Blood Bank","10.363893","77.976364","Trichy Road;New bus stand; Opp to North police station ","9443447160"
"2031","Leonard Hospital Blood Bank","10.165505","77.760672","SH 155; Arunachalapuram; Batlagundu","099442 60622"
"2032","Palani Blood Bank (Run by Annai Educational Trust)","0","0","49; Dindigal Road; 1st Floor; Opposite to Government  Hospital; Dindigul","09150181501, 09842925501"
"2033","Kasturba Hospital Blood Bank","0","0","Gandhigram","N/A"
"2034","Christian Fellowship Hospital Blood Bank","10.48803","77.751707","Dindigul Main Road; Oddanchathram","9994892496"
"2035","Government Hospital Blood Bank","10.448498","77.516908","Dindigul Road; South Anna Nagar; Palani","093446 60502"
"2036","Erode Blood Bank and Clinical Laboratory","11.336191","77.718506","No. 43; Patel Road; 1st Floor;Erode","9841011418"
"2037","Kongu Blood Bank","11.340634","77.715943","TS No. 51/1E Ist floor; Perundurai Road","N/A"
"2038","Lotus Blood Bank","11.326009","77.730096","(Lotus Apollo Hospital) Poonthurai Main Road","N/A"
"2039","Lions Club of Erode Supreme Charitable Trust Blood Bank","0","0","No. 27 S.K.C Road; Erode ","9443931711"
"2040","Dhanvantri Charitable Trust Blood Bank","0","0","No.1. Old Post office Road; Sathyamangalam","N/A"
"2041","IRT Perunthurai Medical College Hospital Blood Bank","11.280826","77.567496","Perundurai; Erode ","N/A"
"2042","Idayam Hospitals Erode Limited Blood Bank","0","0","No.15; Palaniappa Street","9842849575"
"2043","Sri Saanthi Blood Bank (Run by Kaveri trust)","0","0","6-9; kandappa Lane; Brough Road; Erode",""
"2044","Government Head quarters Hospital Blood Bank Erode","0","0","Erode",""
"2045","Government Hospital Blood Bank","11.456457","77.428786","Government Hospital; Gobichettipalayam","09842367605, 09442120800"
"2046","Sri Ram Blood Bank","11.455893","77.42957","4/28; Govt Hospital Road; Gobichettipalayam; ","9443014094"
"2047","Chengalpattu Medical College Hospital Blood Bank","12.677617","79.98029","Anna Nagar; Chengalpattu","9445142097"
"2048","Shri Sathya Sai Medical College and Research Institute Blood Bank","12.746312","80.132393","Tiruporur - Guduvancherry Main Road; Ammapettai; Chengalpat","9842139353"
"2049","Essar Blood Bank","0","0","Arumbakkam Sri AS rajagopalan trust;  No 16. alagesan Road; Vedachalam Nagar",""
"2050","Military Hospital Blood Bank, St. Thomas Mount","13.024872","80.199193","Defence Colony 1st Ave;Ekkatuthangal; Chennai","9840362852"
"2051","Meenakshi Medical College Hospital and Research Institute Blood Bank","12.872611","79.723864","Enathur; Karrapettai Post; Kanchipuram","N/A"
"2052","Government Aringnar Anna Memorial Cancer Hospital Blood Bank","12.86981","79.715799"," Bangalore High Road; Karaipettai","8220328529"
"2053","Government Head Quarters Hospital Blood Bank","12.832978","79.710277","Hospital Road; Kanchipuram","8220328529"
"2054","Annai Medical College and Hospital Blood Bank (Run by Sri Devi Karumari Amman Educational Trust)","12.97068","79.976376","1st Floor Casuality Block; Dr. G. Jayarama Nagar; Pennatur; Sri Perumbudur Taluk","1800 121 3010"
"2055","SRM Medical College Hospital Blood Bank","12.822849","80.048734","SRM Nagar; Potheri; Kattankulathur; Kancheepuram","N/A"
"2056","Chettinad Hospital and Research Institute Blood Bank","12.794973","80.216129","SH 121; Rajiv Gandhi Salai; Kelambakkam ","9443025241"
"2057","Madurantakam Government Hospital Blood Bank","12.50908","79.890064","Hospital Road; Madurantakam","09841419802, 09952523743"
"2058","Karpaga Vinayaga Institute of Medical Sciences Blood Bank","12.592392","79.911956","GST Road; Chinna Kolambakkam; Palayanoor P.O. Madurantagam Taluk. ","N/A"
"2059","Government Hospital Tambaram Blood Bank","12.9456","80.134345","Government Hospital Tambaram; GST Road; Chrompet","9444084885"
"2060","Saveetha Medical College and Hospital Blood Bank (A unit of Saveetha Institute of Medical and Technical Sciences","0","0","S.No. 302/1; Mavalur kuppam Village; Saveetha Nagar; Thandalam","9842247997"
"2061","Deen Dayal Hospital Blood Bank","13.177496","79.810762","No. 61; Deen Dayal Nagar; Kunnavalam Post; Tirupati Road;Thiruvallur Taluk;Tamil Nadu ",""
"2062","M/s Marthandam Blood Bank","0","0","2/64; AIFB Hospital Building; Junction Main Road; Marthandam",""
"2063","Sree Mookambika Institute Medical Science Blood Bank","8.361102","77.292365","14-9C 15; Ist Floor; Medical College Hospital Building; Padanilam; Kulasekaram","094433 77601"
"2064","Government Head Quarters Hospital Blood Bank","8.247696","77.313237","Padmanabhapuram; Thuckalay; Kanyakumari","8012503145"
"2065","M/S Indian Medical Centre, Dr Kumarsawamy Health Center","0","0","Perumal Puram; Kottaram Post",""
"2066","Catherine Booth Hospital Blood Bank (Run By The Salvation Army)","8.200027","77.43068","M/s.  The Salvation Army Catherine Booth Hospital; Arunachalam Colony; Nagercoil","9443374501"
"2067","Kanyakumari Medical College Hospital Blood Bank","8.172512","77.392704","KGMCH;  Asaripallam","07598853127, 08012722728"
"2068","AV Rajan Blood Transfusion Services Clinical and Research Laboratories","0","0","No. 20/6-75 PWD Road; Rajappa Campus; Chettikulam; Nagercoil","9944669799"
"2069","Royal Blood Bank  (Run by Royal Medical Trust)","0","0","No. 40/2 197 PWD Office Road; Peria Nadar Street; Nagerkoil",""
"2070","Kanya Blood Bank","8.17554","77.429731","No.173 A/1; K.P. Road; Ramavarmapuram; Nagercoil","9443360716"
"2071","Vivek Blood Bank","8.184559","77.410413"," 253; K-11;  K.P. Road; Nagercoil","N/A"
"2072","Dr. Jeyasekharan Medical Trust and Nursing Home Blood Bank","8.184416","77.409869","No. 253; KP Road; Nagercoil; Kanyakumari; ","N/A"
"2073","Thangam Blood Bank (Run by Thangam Chartiable Community Health Trust) William Hospital","8.191431","77.423288","No 252; II floor; william hospital complex; Krishnan Koil; Nagerkoil","9442711334"
"2074","Bensam Hospital Blood Bank","8.189676","77.412207","Kalliancaud; NH 66; Nagercoil","094431 35977 "
"2075","Lords Blood Bank (Run By Rajamony Memorial Educational Charitable Trust)","0","0","129; Main Road; Opposite to R.C. Church","9894476132"
"2076","Siventhi Blood Bank (Siventhi Medical Trust)","0","0","None","9894216218"
"2077","Kanyakumari Medical Mission CSI Hospital Blood Bank","8.211518","77.302952","CSI Hospital; SH 180;Neyyoor",""
"2078","Karur Blood Bank","10.963696","78.069084","No. 196/29; Kamarajapuram","N/A"
"2079","Government Head Quarters Hospital Blood Bank","10.962277","78.080228","Government Headquarters Hospital; Karur","09751323125, 09751097848"
"2080","M/S. Rainbow Blood Bank ( Run by rainbow Health &Educational Trust) ","0","0","40 car street; Karur",""
"2081","M/s Karur Voluntary Blood Bank and Laboratary","0","0","20 Kamachi Amman Koil Street",""
"2082","M/S TCR Blood Bank ( Run by TCR hospital & Charitable Trust)","12.5186","78.2137","TCR Multi Speciality Hospital; No.1/450; Avvai Nagar;Near LIC; Krishnagiri.","9585843555"
"2083","Government Hospital Blood Bank","12.72911","77.825456","SH 17; Denkanikotta Road; Hosur;  ","099768 58388, 09443244005"
"2084","Arogya Blood Bank (A Unit of Arogya Seva Hospitals Private Limited)","12.728397","77.824389","35 Opposite CSI church ; Denkanikottai road; New Temple Land Hudco; Shanthi Nagar East; Hosur","N/A"
"2085","Life Care Voluntary Blood Bank (Run by Life Care Trust)","0","0","Venus Arcade; No.2; Ground Floor and First Floor; Old Telephone Exchange Road; Near Parimalam School; Hosur","8123533773"
"2086","Government Head Quarters Hospital Blood Bank","12.524837","78.220022","Gandhi Road; Old pet; Krishnagiri","08807273816, 09444708946"
"2087","Karunya Hospital Blood Bank","0","0","No.46;  Ist Cross Co-Operative Colony","9842802199"
"2088","Government Rajaji Hospital Blood Bank","9.926986","78.131758","Government Rajaji Hospital; Madurai","9786426203"
