"1358","Sanjeevan Blood Bank","16.706599","74.231346","250/B/65  First Floor; Lucky Naresh Banglow; Opposite to Collector Office; Nagala Park; Kolhapur;  ","9371782825"
"1359","Shri.R.R.Patil Shikashan Sheti sanshodhan Aani vikas sanstha Blood Bank","16.680271","74.461733","M/s Adhar Blood Bank; 1st Floor; C.S. No. 16432 / 1; H No. 12/966; C/o. Dr. Dilip Joshi Hospital; Sambhaji Chowk; Rajaram Road; Ichalkaranji; Tal - Hatkanangle; Kolhapur","9823536364"
"1360","Government Medical College General Hospital Blood Bank","18.39451","76.578201","Blood Bank; Government Medical College & Hospital; Old Railway Station;  Gandhi Chowk; Latur","9881417339"
"1361","IRCS - Dr. Bhalchandra Blood Bank","18.401208","76.580639","Red Cross Bhavan; Gandhi Market; Latur ","9421196909"
"1362","Smt. Saraswati Karad Blood Bank","18.429485","76.577846","MIMSR Medical College and Y.C.R. Hospital; Vishwanath Puram;  Ambejogai Road; Latur","09422968442, 09421375504"
"1363","IRCS Nagappa Amberkhane Blood Bank","18.392306","77.106985","Banshelki Road Near Nalegaon Railway Crossing Gate Udgir; Latur ","9405050145"
"1364","Arpan Blood Bank Latur","18.408491","76.551573","H.No R-3-1030;  Old Sonawane Hospital; Near  Ashok Hotel; Main Road; Latur","7507771532"
"1365","Mauli Blood Bank","18.451173","73.89143","Gayatri Hospital; Barshi Road; Latur ","8275599777"
"1366","Global Hospital Blood Bank","18.999282","72.840787","No. 35; Dr. Ernest Borges Road; Hospital Avenue;  Opposite to Shirodkar High School; Parel; Mumbai.","9820168514"
"1367","ACTREC","19.065019","73.064508","Department of Transfusion Medicine; ACTREC;  Tata memorial centre;  Sector 22 Kharghar;  Navi Mumbai.","7498193900"
"1368","Deepak Foundation&#39;s Anviksha Blood Bank","19.082389","72.904481","Paras Darshan; M. G. Road; Ghatkopar; (E) Mumbai ","9820635253"
"1369","Ashirwad Blood Bank","19.017341","72.848164","Imperial Mahal; 2nd Floor  Above Shabana Stores; Khodadad Circle; Dr. B. A. Ambedkar Road; Dadar TT;  Mumbai","9820000236"
"1370","Asian Heart Institute and Research Center","19.065253","72.860832","ICICI Tower;  Bandra Kurla Complex; Bandra (E) Mumbai","9820434775"
"1371","B.S.E.S M.G. Hospital Blood Bank","19.119457","72.844948","Rotary D. G. Goenka Blood Bank; Near Railway Station Andheri (W); Mumbai","9819456505"
"1372","Bandra Holy Family Hospital Society Blood Bank","19.055059","72.827202","Saint Andrews Road; Bandra; Mumbai","9892845140"
"1373","Bhabha Atomic Research Centre Hospital Blood Bank","19.042464","72.914358","BARC Hospital; Anushakti Nagar Mumbai","9619920707"
"1374","Bhatia General Hospital and Blood Bank","0","0","Tukaram Javji Road; Tardeo; Mumbai",""
"1375","Bombay Hospital Trust Blood Bank","18.94103","72.82816","12; New Marine Lines Mumbai","9820302628"
"1376","Borivali Blood Bank (Doshi Memorial Charitable Trust)","19.199816","72.845937","3;4;5; Vithal Apartment; Near Ram Mandir; Mandpeshwar Road; Opposite; Flyover;  Borivali (w) ","9821052413"
"1377","Breach Candy Hospital And Research Centre Blood Bank","18.972677","72.804312","60 A; Bhulabhai Desai Road; Mumbai","9820286291"
"1378","B. Y. L. Nair Hospital Blood Bank","18.974279","72.822573","New OPD Building. 2nd Floor; Dr. A. L. Nair Road Mumbai Central; Mumbai ","9820887694"
"1379","Cama and Albles Hospital - Abdul Fazalbhoy Blood Bank","18.941948","72.832185","Mahapalika Marg; Mumbai CST","9867798441"
"1380","Cumbala Hill Hospital And Heart Institute Blood Bank","0","0","93-95; August Kranti Maidan; Mumbai","9821097083"
"1381","Dr. Babasaheb Ambedkar Memorial Hospital - Central Railway Hospital Blood Bank","0","0","Central Railway Byculla; (E) Mumbai",""
"1382","Dr. L. H. Hiranandani Hospital Blood Bank","19.120591","72.917105","Hill Side Avenue; Hiranandani Gardens; Powai ","9619597757"
"1383","ESIC Model Hospital cum ODC Blood Bank","19.118392","72.86724","Room No. 20/A; 1st Floor; ESIC Model Hospital cum ODC & PGIMSR; Central Road; M.I.D.C; Opposite to MIDC Police Station; Andheri (East); Mumbai ","8691853888"
"1384","Fortis Hospital Blood Bank","19.162122","72.942063","Mulund Goregaon Link Road; Nahur ; Mumbai ","9519298226"
"1385","G. T. Hospital Blood Bank","18.946532","72.833317","Near L.T.Marg Police Station; Mumbai","7738645537"
"1386","Hematology Laboratory Blood Bank","19.183375","72.853442","Parekh House; Ground Floor; 14 Mama Parmanand Marg;  Mumbai.","9820070001"
"1387","Harilal Bhagwati Hospital Blood Bank","19.245458","72.856027","S. V. P. Road; Borivali-W; Mumbai","9820368493"
"1388","Suburban Hi-tech Blood Bank","19.183781","72.849166","Shagun Building; 2nd Floor; 206; Rani Sati Road; Malad (E)","9004437823"
"1389","Holy Spirit Hospital Blood Bank","19.128442","72.866496","Mahakali  Road; Andheri (E); Mumbai","9869449892"
"1390","Indian Red Cross Society Bombay City Branch Blood Bank","18.932476","72.836574","Blood Centre; 141; Shahid Bhagatsingh Road; Town Hall Compound; Near R.B.I. Fort","9819424404"
"1391","INS - Ashwini Blood Bank","18.901263","72.815698","Near R. C. Church; Colaba; Mumbai","9819069863"
"1392","Jaslok Hospital And Research Centre Blood Bank","18.971653","72.809968","15; Dr. G. Deshmukh Marg; Mumbai","9321793987"
"1393","K. B. Bhabha General Hospital Blood Bank","19.057493","72.833636","R. K. Patkar Marg; Bandra (W); Mumbai","9820076632"
"1394","K. J. Somaiya Medical College and Hospital Blood Bank","19.047282","72.874706","Somaiya Ayurvihar Complex; Eastern Express Highway; Sion; Mumbai ","9819426169"
"1395","Kapoorben Vasanji Lathiya Blood Bank - Nanavati Hospital","19.095831","72.840101"," Dr Balabhai Nanavati Hospital;S V Road; Vile Parle (W); Mumbai ",""
"1396","K. E. M. Hospital Blood Bank","19.001515","72.841877","Acharya Donde Marg; Parel; Mumbai","9869104114"
"1397","Kohinoor Hospital Blood Bank","19.076212","72.886208","Upper Basement; Room No. 29 to 43; Kirol Road; Off L.B.S Marg; Kurla (w)","7666188848"
"1398","Kokilaben Dhirubhai Ambani Blood Bank","19.131221","72.824772","4 Bunglows; Achutrao Patwardhan Marg; Andheri (west); Mumbai ","9320070111"
"1399","Lilavati Hospital and Research Centre Blood Bank","19.051089","72.828889","A 791; Bandra Reclamation; Bandra (W); Mumbai","9869522828"
"1400","Lokmanya Tilak Municipal Hospital Blood Bank","19.036984","72.859049","O. P. D. Building; 1st Floor; Sion (W); Mumbai","9892245254"
"1401","M. T. Agarwal Municipal General Hospital Blood Bank","19.177861","72.946234","Dr. R. P. Road; Mulund (W); Mumbai","09869685857, 09930468583"
"1402","Mahatma Gandhi Seva Mandir Blood Bank","19.055801","72.836932","Mahatma Gandhi Seva Mandir Hospital; 2nd Floor; Opposite to Bandra Lake; S. V. Road; Bandra (W); Mumbai  ",""
"1403","Manas Serological Institute Blood Bank","19.13522","72.848108","CTS NO-167 / 168 / A1; 101-104; Grace Plaza; S. V. Road;  Near Railway Phatak; Jogeshwari (W); Mumbai ","9833832271"
"1404","Masina Hospital Blood Bank","18.974886","72.835711","Sant Savta Marg; Byculla (E) ","8879231091"
"1405","Mumbai Port Trust Blood Bank","0","0","Nadkarni Park; Wadala (E) Mumbai",""
"1406","N.  Wadia Maternity  Hospital Blood Bank","19.003238","72.842837","Acharya Donde Marg; Parel; Mumbai","9004362229"
"1407","Matoshri Valbai Mulji Shah - Arpan Blood Bank","19.142653","72.933304","Aniraj Tower;  Janta Market; L.B.S Marg; Bhandup (W); Mumbai","9423696022"
"1408","Navjivan Blood Bank and Lab","19.23024","72.852643","Shop No.1; Abhilasha II; Punjabi Lane Borivali (W)","9820040536"
"1409","P. D. Hinduja National Hospital And Medical Research Centre Blood Bank","19.033615","72.838105","Veer Savarkar Road; Mahim (W); Mumbai","9820606355"
"1410","Meenatai Thackeray Blood Bank - Siddharth Hospital","19.159649","72.840284","Siddharth Nagar; Prabhodhan Kridabhawan Marg; Goregaon (W)","9320918214"
"1411","Prince Aly Khan Hospital Blood Bank","18.97084","72.836617","Aga Hall; Nesbit Road; Mazgaon; Mumbai ","9821035341"
"1412","Dr. R. N. Cooper General Hospital Blood Bank","19.107714","72.835618","North south Road No-1; Juhu; Vile-Parle (W) Mumbai","9987063770"
"1413","Rajawadi Blood Bank - Seth V. C. Gandhi & M. A. Vora Municipal General Hospital","19.079304","72.901693","Seth V. C. Gandhi and M. A. Vora M; Rajawadi; Ghatkopar-(E); Mumbai","9892784878"
"1414","S. L. Raheja Hospital Blood Bank","19.046572","72.842207","Mahim; Raheja Rugnalaya Marg; Mumbai","9821241031"
"1415","S. R. Mehta and Sir. K.P. Cardiac Institute Blood Bank","19.032412","72.85958","Plot No. 96; Road No.31; King Circle Sion; (E) Mumbai  ","9987020981"
"1416","Saifee Hospital Trust Blood Bank","18.952471","72.818058","15/17; Maharishi Karve Marg; Opposite to Charni Road Station Mumbai","9869784307"
"1417","Sarvodaya Hospital Samarpan Blood Bank","19.089801","72.907187","Office Building; 2nd Floor; Sarvodaya Hospital; LBS  Marg; Ghatkopar (W); Mumbai","9594032520"
"1418","Seven Hills Health Care Private Limited Hospital Blood Bank","19.117797","72.87809","Blood Bank; 2nd Floor; Block-16; Seven Hills Hospital;  Survey No.155; 156; 162 - 168 Part; Marol - Maroshi Road;   Andheri (E); Mumbai ","9820339204"
"1419","Shushrusha Citizens Co-operative Hospital Blood Bank","19.023426","72.837899","698-B Ranade Road; Dadar; Mumbai","9022240366"
"1420","Sir J.J.Group of Hospital Blood Bank","18.962909","72.833639","Main Building; Ground Floor; Sir J. J. Hospital; Byculla; Mumbai","9322106373"
"1421","Sir J.J.Mahanagar Rakthapedhi","18.963334","72.832489","Sir J.J Mahanagar Raktapedhi; F. D. Petit Building; J.J.Campus; J. J. Road; Byculla; Mumbai ","8275001905"
"1422","Saint George&#39;s Hospital & Regional  Blood Bank","18.94027","72.837319","Saint George&#39;s Hospital; Behind General Post Office;  P. D&#39;Mello Road; Fort; Mumbai","9867993451"
"1423","Tata Memorial Hospital Blood Bank","19.004856","72.842945","5th Floor; Service Block; Dr. E. Borges Road; Parel; Mumbai ","9820340073"
"1424","The B.D. Petit Parsee General Hospital Blood Bank","18.968704","72.805743","B.Petit Road; Cumballa Hill;  Mumbai","9323570506"
"1425","V. N. Desai Municipal General Hospital Blood Bank","19.078822","72.844994","T. P. S. II; 11th Road; Santacruz (E) Mumbai","9820618132"
"1426","West Coast Blood Bank","19.042954","72.84073","Basement 101; Moon Building; 798; Mori Road; Mahim(W); Mumbai","9820721197"
"1427","M/s. Balasaheb Thackerey Blood Bank","0","0","Mumbai",""
"1428","M/s. Pallavi Blood Bank","0","0","Mumbai",""
"1429","ESI-PGIMSR, MGM Hospital Blood Bank","0","0","Mumbai",""
"1430","M/s Sion Blood Bank","0","0","Mumbai",""
"1431","Harkisandas  Marottamdas Hospital Blood Bank","0","0","Mumbai",""
"1432","Government Medical College Blood Bank Nagpur","21.126097","79.097101","Model Blood Bank; 2nd Floor; Hospital Building; Government Medical College & Hospital; Nagpur  ","9822941695"
"1433","Super Speciality Hospital and Medical Post Graduate Institute Blood Bank","21.123952","79.102367","Maenad Road; Near RST Cancer Hospital; Nagpur","8275531628"
"1434","Indira Gandhi Medical College and Hospital Blood Bank","21.153917","79.092894","IGMC Hospital; Central Avenue Road; Nagpur ","7709884278"
"1435","Daga Memorial Women Government Hospital Blood Bank","21.151511","79.105434","Gandhibag; Nagpur","9422762492"
"1436","Central India Institute of Haematology & Oncology&#39;s Blood & Blood Component Bank and Apheresis Unit","21.134731","79.080223","Plot No-14/2; Park Corner; Bal Raj Marg; Near Loma Square; Dhantoli; Nagpur","9822723264"
"1437","Jeevan Jyoti Blood Bank and Component","21.123051","79.057149","J P Chamber; Madhav Nagar; Dakshin Ambakshari Road  Nagpur","9422113811"
"1438","Dr. Hegdewar Blood Bank","21.140579","79.060505","2; Sitaram Smruti; West High Court Road; Laxmibhuvan Square; Audumbar Apartment; Dharmpeth; Nagpur ","9922407171"
"1439","Sainath Blood Bank","21.134294","79.076369","531;Jaiswal Building; Above R.K. Traders; Old shukrawari Road; Sakkardara Nagpur","9422502066"
"1440","Ayush Blood Bank and component Lab","21.135231","79.072978","9th Floor; A wing; 901-905; 910-912; Lokmat Building; Nagpur","9823051508"
"1441","Lifeline Blood Bank Components and Apherisis Centre Blood Bank","21.138999","79.063093","Neeti Gaurav complex ; 2nd Floor; Central Bazar Road; Lokmat Square; Ramdaspeth; Nagpur ","9552556425"
"1442","Rainbow Blood Bank","21.133584","79.072736","3rd Floor; 282; Rainbow Diagnostic Services Central Bazar Road; Ramdas Peth; Nagpur","9975844830"
"1443","NKP Salve Institute of Medical Science and Research Center (Lata Mangeshkar Hospital), Blood Bank","21.144346","79.078848","5; YMCA Complex; Digdoh Hills; Hingna Road; Nagpur","9850448905"
"1444","Nandkishor Education Society Trust - Arpan Voluntary Blood Bank","0","0","Nagpur",""
"1445","Dr. Shankarrao Chavan Government Medical College and Guru Govindsinghji Memorial Hospital Blood Bank","19.109305","77.29295","Vazirabad; Nanded ","09890172702, 09503007847, 09860127959"
"1446","Indian Red Cross Society Blood Bank","17.399811","78.485456","Parsi Anjuman Complex; Vazirabad; Nanded      ","9850947545"
"1447","Golvalkar Guruji Blood Bank","19.168646","77.326553","Plot No.2-12-407; Bandhaghat Road; Vazirabad; Nanded","9822589088"
"1448","Arpan Blood Bank","19.161084","77.303022","2nd Floor; Dayma Complex; Doctor Lane; Ghamodia;Nanded","9881907646"
"1449","Guru Gobindsinghji Blood Bank","19.156029","77.309","Geeta Bhavan 1 & 2 Floor; House No 3-1-366; Near Government; Opposite to Ayurvedic College; Bus Stand Road; Vazirabad; Nanded          ","9145432520"
"1450","Nanded Blood Bank","19.161264","77.304543","Shivaji Nagar ;Opposite to Adhar Hospital; Nanded ","9422382810"
"1451","Hazur Saheb Blood Bank","19.153093","77.318654","2nd Floor; Opposite to Bank of India; Sant Kripa Market; GG Road; Nanded ","09689100000, 09960596860"
"1452","Civil Surgeon - District General Hospital Blood Bank","21.33867","74.234768","Nandurbar; Railway Station Road Survey No.406; Civil Hospital Compound;  Sakri Road; Near Collector Office Nandurbar  ","09860408109, 09422238791"
"1453","Sahada Blood Bank - Shree Swami  Samartha Vaidyakiya  Shaikshanik and Sanshodhan Sanstha ","21.554798","74.472874","C/o. 1st Floor; Shushrut Hospital; Khetiya Road; Survey  No. 67/3; Plot No. 3; Sahada; Nandurbar","9371855918"
"1454","Jankalyan Rakta Pedhi","21.36433536","74.24463853","Nandurbar;1st Floor; Vivekanand Hospital; Desaipura; Nandurbar ","9096175855"
"1455","Malegaon Blood Bank","20.55474","74.524396","2nd Floor; West End Complex; Satana Naka; Malegaon ","9371550550"
"1456","Seva Blood Bank","20.552689","74.516643","Nilkanth Building; Satana Naka; Satana Road; Malegaon; Nashik","09823967555, 08805611555"
"1457","Roachabai Sugnomal Manwani - Cantonment General Hospital Blood Bank","19.903354","73.825824","Vadner Road; Devlali; Nashik","09850536784, 09404803045, 09420746965             "
"1458","Metro Blood Bank - District (Civil) Hospital Nashik","19.996886","73.778198","District - Civil Hospital Blood Bank; Near Thakkar Bazaar;  Trimbak Naka; Nashik","9850536784"
"1459","Sainik Aspatal Military Hospital Blood Bank","19.9483203","73.841866","Sainik Aspatal; Military Hospital; Deolali","9545355252"
"1460","Ansar Blood Bank","20.552043","74.532641","1398/1; Islampura; Industrial Society Compound; Quidwai Road; Malegaon; Nasik","9890353737"
"1461","Arpan Blood Bank and Blood Component Laboratory and Research Centre","20.004874","73.787164","1st Floor; Office No.102/103; Dr. Athawale Chambers; Opposite to Gavkari Press Tilak Path; Nashik  ","09822324340, 09422770765"
"1462","Jankalyan Blood Bank","20.008838","73.7702","3; Shree Nagar; Old Gangapur Naka; Gangapur Road; Nashik ","9823114809"
"1463","NDMVPS Medical College and Hospital Blood Bank","20.037363","73.852998","At Post Adgaon Dist Nashik ","9422237694"
"1464","Samta Blood Bank","19.984791","73.782607","F-1; 1st Floor Suyojit Comercial Complex; Mumbai Agra Highway; Below Data Mastics; Mumbai Naka; Nashik  ","9975997867"
"1465","Sanjeevani Blood Bank","19.975586","73.803963","Nashik; Krushna-Chaya Bangla; Plot No. 10/11; Kurdukar Nagar; Behind Fame Theatre; Nashik Pune Road; Nashik ","09730733888, 09370355501"
"1466","Jijau Mahila Sevabhavi Sansthan Nashik Blood Bank and Transfusion Research institute Blood Bank","19.990656","73.775241","Ishwar Krupa Ganesh Nagar; Tidke Colony; Nashik ","9890609318"
"1467","The Santajee Educational and Medical foundation Trust - Jeevan  Blood Bank ","19.987781","73.784138","Suyojit City Center; G-11; 12; 13; S. No. 567/1/1 & 567/1/3 (CTS No. 7249 & FP No. 60) Mumbai Naka; Near Mahamarg Bus Stand; Nashik  ",""
"1468","SMBT Institute of Medical Science and Research Centre - Blood Bank and Component","19.76062","73.769851","None","9011067101"
"1469","Hindustan Aeronautics Limited Blood Bank","20.105897","73.931932","HAL; Aircraft Division; HAL; In Front of GES HAL High School; Ojhar Township; Niphad; Nashik ","9420592940"
"1470","J.D.C. Bytco Hospital Blood Bank","19.949132","73.838742","1st Floor; Bytco Hospital; Nashik Road; Behind Durga Garden; Shahu Path; Nashik",""
"1471","Regional Referal Hospital Blood Bank","0","0","Medical Superintendent; Regional Referal Hospital (Superspeciality Hospital) Blood Bank; Nashik",""
"1472","Shri Krishna Blood Bank","17.83503","76.622149","Dr. Patange Hospital Building; Ajay Nagar Omerga; Omerga;  Osmanabad  ","9422069904"
"1473","Civil Surgeon, General Hospital Blood Bank","18.18077","76.034735","Civil Hospital Osmanabad; Tqand; Osmanabad ",""
"1474","Civil Surgeon - District General Hospital Blood Bank","19.271699","76.765032","Blood Bank Civil Surgeon; District General Hospital Blood Bank; Subhash Road; Parbhani ","9422176541"
"1475","Kanthak Sevabhavi Sanstha - New Life Blood  Bank","19.273124","76.782625","Plot No 22; Survey No 389 and 394; Beside Gurudwara; Station Road; Parbhani ","09823093235, 09822642102"
"1476","Indian Red Cross Society Blood Bank","18.152597","74.574996","Indian Red Cross Society (IRCS); (Late Manikbai Chandulal Saraf) Blood Bank; Near Government Silver Jubilee Hospital; Patas Road; Baramati; Pune","9850033891"
"1477","Pune Chest and General Hospital Blood Bank","18.575032","73.80537","Aundh Cest Hospital; Aundh Camp; Pune","09422780176, 09604871471"
"1478","Sasoon Sarvopchar Hospital Blood Bank","18.515846","73.858714","Ground Floor; Section 5; Opposite to Central Medical Stores; Station Road; Pune","9423575986"
"1479","Armed Forces Blood Bank","18.505159","73.889694","Vanwadi Armed Force Medical College; Pune","09850269248, 09545641023"
"1480","Jankalyan Raktapedhi Pune","18.50092","73.857531","1003; Shukrawar Peth; Swargate - Saras Baugh Road; Near Natraj Hotel; Pune","09423066622 , 07350002460"
"1481","Inlaks Budharani Hospital Blood Bank","18.534391","73.887409","7-9; Koregaon Park; Pune","9373510112"
"1482","Indian Serological Institute Blood Bank","18.506291","73.84264","21; Anand Baugh; Navi Peth; Near Vaikunth; Pune","09096039023 , 9096040549 ,9673399497"
"1483","Acharya Anandrushiji Blood Bank","18.508647","73.844846","191-192; New Sadashiv Peth; S. M. Joshi Foundation Building; Near Patrakar Bhavan; Pune","09764184192, 09822077702"
"1484","Akshay Blood Bank","18.47143","73.959674","Survey No.10/1/3; Unnati Nagar; Bantar High School; Hadapsar; Pune","9890244339"
"1485","Garware Blood Bank - Talegaon Rural Hospital","18.735319","73.675984","Talegaon Dhabhade; Maval; Pune ","09422080758,   08087000000,  08087099051"
"1486","Jehangir Hospital Blood Bank","18.530392","73.876808","32; Sasoon Road; Pune ","8888821087"
"1487","KEM Hospital Blood Bank","18.519784","73.866906","Sardar Moodliar Road; Rastha Peth; Pune",""
"1488","Grant Medical Foundation A.H. Wadia Trust Blood Bank","18.533369","73.876939","40; Sassoon Road; Ruby Hall Clinic; Post Box No. 70; Pune","9890148566"
"1489","Bharati Vidyapeeth Medical Foundation Blood Bank","18.459914","73.855994","Sector - 28; Dhankawadi; Pune Satara Road; Pune","9420320999"
"1490","Padmashree Dr. D.Y. Patil (Vishweshwar) Blood Bank","18.624175","73.82126","Padmashree; Dr. D. Y. Patil Medical College Hospital; Sant Tukaram Nagar; Pimpari; Pune","9561792418"
"1491","Deenanath Mangeshkar Hospital Blood Bank","18.502108","73.832232","Erandawane; Near Mhatre Bridge; Pune","9822545665"
"1492","Poona Serological Institute Blood Bank","18.516656","73.866532","C.T.S. No. 592; 3rd Floor; Dhanwantari Complex; Rasta Peth; Pune","09822252965, 09822252965"
"1493","Sahiyadari Speciality Hospital Blood Bank","18.513091","73.839308","Kokoan Mitra Mandal Medical Port Trust&#39;s Sahiyadari Speciality Hospital Blood Bank; Plot No-30 C; Erandvane; Karve Road; Pune ","9850540682"
"1494","Aditya Birla Memorial Hospital Blood Bank","18.625716","73.774775","Survey No:31; Near Morya Mangal Karyalay; Thergaon; Chinchwad; Pune ","9011352331"
"1495","Rakesh Jain Memorial Blood Bank","18.510752","73.842158","Poona Hospital and Reserch Centre 27; Sadashiv Peth; Pune  ","9689947454"
"1496","Noble Hospital Blood Bank","18.505035","73.927256","B-007; Basement C/o. Noble Hospital; 153 Magarpatta City Road; Hadapsar; Pune  ","9423581029"
"1497","Smt Kashibai Navale General Hospital Blood Bank","18.45624","73.822183","Sr. No. 50/15 building NO.5 2nd Floor; Narhe; Ambegaon; Pune  ","9370146779"
"1498","Pimpari Serological Institute Blood Bank","18.624322","73.807929","Esteem Tower; opposite K.S.B. Pump; Pune-Mumbai Highway; Kharalwadi; Pimpari ","92,255,078,119,822,600,000"
"1499","Chakan Blood Bank","18.762296","73.860866","Sr. No. 4976/1/2 Gate No. 2401; Yashwantnagar Ambethan Road. A/P Chakan; Khed; Pune ","9822524260"
"1500","R.G Gholap Memorial Blood Bank","18.487158","73.857098","Office No. 301; 3rd Floor Ashoka Centre; S. No - 47/14; Satara Road; Parvati; Pune","9822442140"
"1501","Kranti Mitra Mandal Charitable Trust Blood Bank","18.501083","73.939062","1st Floor PMT Buiding Gadital; Hadapsar; Pune ","9960771438"
"1502","Krantiveer Chapekar Bandhu Blood Bank","18.625689","73.784672","Pimpri Chinchwad Mahanagar Palika Talera Hospital; Tanaji Nagar Chinchwad; Pune  ","9922501583"
"1503","The New Century Medical & Education Foundation Trust - NCORD Blood Bank & Aphaeresis Centre","18.56475","73.800994","NCORD Blood Bank and Aphaeresis centre; S. No. 241/2/1; Geet Ganga Building; Medipoint Hospital Lane; Baner; Pune","9822502812"
"1504","Ekta Apang Vikas Sanstha Blood Bank","18.477273","73.90302","Office No. 17/18/19; 1st Floor; Sunshree Woods Commercial Complex; NIBM; Kondhwa; Haveli; Pune","9822009268"
"1505","Chattrapati Shahu Maharaj Pratisthan","18.466519","73.857679","S.No. 30; 4th floor; office no. 41; 402; 403; and 5th floor off 502; waris Heights; Pune-Satara Road; Dhankwadi; Pune","9890927792"
"1506","Chattrapati Shahu Maharaj Pratisthan Blood Bank","18.466161","73.857642","S. No. 30; 4th Floor; Office No. 41; 402; 403; and 5th Floor off 502; Waris Heights; Pune - Satara Road; Dhankwadi; Pune","9890927793"
"1507","M/s. Vidyashree Charitable Trusts Om Blood Bank","0","0","Pune",""
"1508","District Civil Surgeon Blood Bank","18.640782","72.871716","District Hospital Blood Bank; Civil Hospital Campus; Sea Face Road; Alibag  ","9881671533"
"1509","Kakasaheb Chitle Memorial Centre Sanchalit - Jankalyan Blood Bank","18.082736","73.42265","C.S. No. 1651; Near Lokmanya Vyayamshala; Shiwaji Chowk; Mahad; Raigad","9420047251"
"1510","M.B. More Foundation Blood Bank","19.067134","73.066397","Ghar. No. 412; 1st Floor; Mangaon; Morba Road; Opposite to Civil Hospital; Mangaon; Raigad ","9421230000"
"1511","Advanced Centre for Treatment Reasearch and Education in Cancer","19.065019","73.064507","Owe Village; Sector 22; Plot No. 2; Kharghar; Navi Mumbai ","9594000503"
"1512","M/s. Navi Mumbai Blood Bank","19.034045","73.029533","Navi Mumbai Blood Bank; Vishwanath Bhavan; C-87; Sector 12; Kharghar; Navi Mumbai","09870653138, 09223300850"
"1513","Shree Sai Blood Bank & Component","18.99397","73.106561","103;104;105;1st Floor Tirthraj Building; Old Thana Naka Road; Near Taluka Police Station;  Old Panvel; Raigad","9820344697"
"1514","Rotary Club New Panvel charitable Trust s Late Dr. B.V. Limaye Blood Bank","19.008249","73.108321","Plot No-8; Sect.1; Khanda Colony; Mumbai Pune Road; New Panvel (W) ","9870211554"
"1515","Civil Surgeon - General Hospital Blood Bank","16.989126","73.298866","Civil Hospital; Ratnagiri","7709268824"
"1516","Shree Swami Samarth Blood Bank","17.399914","73.547448","B.K.L.Walwalkar Hospital Diagnostic & Research Centre; Shree Kshetra Darvan; Chiplun; Ratnagiri","9922728167"
"1517","Indian Red Cross Society Blood Bank","17.019013","73.298977","Khareghat Road; Ratnagiri","9730818228"
"1518","Indian Red Cross Blood Bank","0","0","Ratnagiri",""
"1519","Prakash Blood Bank & Blood Component Seperation Unit","0","0","Prakash Shikshan Mandal&#39;s Prakash Hospital & Research Centre; Islampur Sangli Road; Uran - Islampur; Tal -Walwa; Dist- Sangli (Ms) ","02342 661212, 02342 661224"
"1520","Padmabhushan Vasantdada Patil Government Hospital Blood Bank","16.852571","74.574678","Padmabhushan Vasantdada Patil Government Hospital ; Blood Bank; Dr. Ambedkar Road; Sangli .                                          ","09011654102, 09890935611"
"1521","Rajaram Bapu Blood Bank","17.048399","74.251122","Islampur C.S. No. 99/1; Near Islampur Spiral CT-Scan; Peth-Sangli Road ","8275391940"
"1522","Vasantdada Patil Blood Bank and Haematology Research Centre","16.82132","74.649492","AIP - Miraj; Mirasaheb Shopping Complex;  Opposite to City Police Station; Miraj; Sangli","9422614033"
"1523","Miraj Medical Centre - Wanless Hospital Blood Bank","16.832135","74.645472","Wanless Hospital Blood Bank; Medical Centre; Miraj","9604542311"
"1524","Jeevan Rekha Charitable Trust Blood Bank","17.049271","75.204853","H. No. 329/E; Ward No. 5; 1st Floor; Umrani Road; A/p-jath; Sangli ","9822112722"
"1525","Smt. Anila Kantilal Kothari Blood Bank & Department of Hemato Oncology","16.833879","74.635364","Dr. D. K. Gosavi Memorial; Shri Siddhivinayak Ganapati Cancer Hospital; Sangli - Miraj Road; Miraj","989022105"
